{
  "shot_id": "NH-S101-SH008",
  "song_id": "NH-S101",
  "duration_s": 6,
  "camera": {
    "shot_size": "close-up",
    "movement": "locked-off",
    "lens_mm": 85
  },
  "subjects": [
    "pengold"
  ],
  "setting": "Pengold's mayoral office at dawn",
  "mood": "care and precision",
  "action": "He sets the paper down carefully, aligned to the edge of the desk.",
  "prompt": "close-up, locked-off, the hands of a controlled man in his late forties, neat conservative hair greying at the temples, calculating unhurried eyes, medium solid upright build, municipal mayoral suiting in dark muted wool, white shirt, no ostentation, papers aligned squarely, unhurried processional bearing setting a folded newspaper down on a mahogany-laminate desk and squaring it precisely to the desk edge, tungsten desk lamp, dawn light held off the desk, prestige political drama, House of Cards season one color grade, Roger Deakins single-source tungsten lighting, anamorphic cinematography, Arri Alexa, slight 35mm film grain, color palette desaturated twelve percent, warm tungstens lifted, deep browns and charcoals in shadows, faint cool blue holding only in the deepest blacks, photographic realism, cinematic",
  "negative_prompt": "cartoon, anime, illustration, painted look, exaggerated lighting, lens flare, smile at camera, comedic expression, on-screen text, chyron, caption overlay, contemporary saturation, winking, irony, logo, watermark, modern smartphone, laptop screen prominent in frame",
  "keyframe": {
    "source": "t2i",
    "ref_lora": "pengold",
    "seed": 101008
  },
  "seed": 101008,
  "continuity": {
    "prev_shot": "NH-S101-SH007",
    "flf2v": false
  },
  "render": {
    "width": 640,
    "height": 640,
    "fps": 16,
    "steps": 4,
    "duration_s": 6
  }
}
