{
  "shot_id": "NH-S348-SH002",
  "song_id": "NH-S348",
  "duration_s": 7,
  "camera": {
    "shot_size": "extreme-wide",
    "movement": "locked-off",
    "lens_mm": 16
  },
  "subjects": [
    "dick",
    "pengold",
    "summer"
  ],
  "setting": "The Anti-Thanksgiving Feast stage",
  "mood": "triumphant TWEEEDS theme, brass forward",
  "action": "BEAT 1 - THE DENUNCIATION. Full stage, full chorus, full orchestra. Dick has just been seized by the City AG and is downstage center being led in chains toward the stage-left exit. The chorus is in formation behind Pengold at the podium, mauve books raised in unison the way congregants raise hymnals. Summer's portrait is at half-height and rising, lit from below in Socialist-Realist gold.",
  "prompt": "extreme wide shot, locked-off, a municipal festival hall stage set for a keynote, a plain podium up-center, a full chorus in formation on risers behind it, display tables of worn trade paperbacks in dusty brownish mauve, the color of a faded 1970s university-press paperback, not lavender, not aubergine, not pink, a stage-left exit doorway, an upstage-right pool of flatter light, a monumental Socialist-Realist painted portrait of the poised patrician woman, heroic and idealized, gazing upward, at half-height and rising behind the podium, lit from below in golden light, a controlled man in his late forties, neat conservative hair greying at the temples, calculating unhurried eyes, medium solid upright build, municipal mayoral suiting in dark muted wool, white shirt, no ostentation, papers aligned squarely, unhurried processional bearing at the podium, a full chorus behind him raising worn trade paperbacks in dusty brownish mauve, the color of a faded 1970s university-press paperback, not lavender, not aubergine, not pink in unison like hymnals, downstage center a lean charismatic man in his early thirties, grown-out product-free hair, thin wire-frame glasses, earnest alive expression, dark raw selvedge denim, a tailored heritage workwear jacket over a faded vintage band t-shirt, minimalist off-white sneakers, a handwoven scarf in steel shackles being led by two officers toward the stage-left exit, a poised woman in her early forties, patrician bearing, dark hair drawn back with professional precision, composed watchful eyes, slim upright frame, professional-class activist tailoring in muted expensive fabrics, still hands, sincere unsmiling composure standing frozen beneath the rising portrait, prestige political drama, House of Cards season one color grade, Roger Deakins single-source tungsten lighting, anamorphic cinematography, Arri Alexa, slight 35mm film grain, color palette desaturated twelve percent, warm tungstens lifted, deep browns and charcoals in shadows, faint cool blue holding only in the deepest blacks, photographic realism, cinematic",
  "negative_prompt": "cartoon, anime, illustration, painted look, exaggerated lighting, lens flare, smile at camera, comedic expression, on-screen text, chyron, caption overlay, contemporary saturation, winking, irony, logo, watermark, modern smartphone, laptop screen prominent in frame",
  "keyframe": {
    "source": "t2i",
    "ref_lora": "dick",
    "seed": 348002
  },
  "seed": 348002,
  "continuity": {
    "prev_shot": "NH-S348-SH001",
    "flf2v": true
  },
  "render": {
    "width": 640,
    "height": 640,
    "fps": 16,
    "steps": 4,
    "duration_s": 7
  }
}
