{
  "shot_id": "NH-S101-SH010",
  "song_id": "NH-S101",
  "duration_s": 7,
  "camera": {
    "shot_size": "medium",
    "movement": "locked-off",
    "lens_mm": 50
  },
  "subjects": [
    "pengold"
  ],
  "setting": "Pengold's mayoral office at dawn",
  "mood": "measured authority",
  "action": "Over the held bass note, Pengold's recitative, addressed to the federal investigation he can feel circling the building.",
  "prompt": "medium shot, locked-off, slow tighten, a controlled man in his late forties, neat conservative hair greying at the temples, calculating unhurried eyes, medium solid upright build, municipal mayoral suiting in dark muted wool, white shirt, no ostentation, papers aligned squarely, unhurried processional bearing seated at the desk speaking low to the middle distance, three worn trade paperbacks in dusty brownish mauve, the color of a faded 1970s university-press paperback, not lavender, not aubergine, not pink on the credenza behind him, single-source tungsten, dawn thin at the window, prestige political drama, House of Cards season one color grade, Roger Deakins single-source tungsten lighting, anamorphic cinematography, Arri Alexa, slight 35mm film grain, color palette desaturated twelve percent, warm tungstens lifted, deep browns and charcoals in shadows, faint cool blue holding only in the deepest blacks, photographic realism, cinematic",
  "negative_prompt": "cartoon, anime, illustration, painted look, exaggerated lighting, lens flare, smile at camera, comedic expression, on-screen text, chyron, caption overlay, contemporary saturation, winking, irony, logo, watermark, modern smartphone, laptop screen prominent in frame",
  "keyframe": {
    "source": "t2i",
    "ref_lora": "pengold",
    "seed": 101010
  },
  "seed": 101010,
  "continuity": {
    "prev_shot": "NH-S101-SH009",
    "flf2v": false
  },
  "render": {
    "width": 640,
    "height": 640,
    "fps": 16,
    "steps": 4,
    "duration_s": 7
  }
}
