{
  "shot_id": "NH-S348-SH012",
  "song_id": "NH-S348",
  "duration_s": 8,
  "camera": {
    "shot_size": "medium",
    "movement": "static",
    "lens_mm": 50
  },
  "subjects": [],
  "setting": "Black",
  "mood": "silence",
  "action": "BLACK SLUG: eight seconds of blackout before any house light. Eight seconds is cruel. Eight seconds is correct. Then house lights, not stage lights (see PRODUCTION_BLUEPRINT: The Curtain Call Problem).",
  "prompt": "a pure black frame, no light, no content, absolute darkness, prestige political drama, House of Cards season one color grade, Roger Deakins single-source tungsten lighting, anamorphic cinematography, Arri Alexa, slight 35mm film grain, color palette desaturated twelve percent, warm tungstens lifted, deep browns and charcoals in shadows, faint cool blue holding only in the deepest blacks, photographic realism, cinematic",
  "negative_prompt": "cartoon, anime, illustration, painted look, exaggerated lighting, lens flare, smile at camera, comedic expression, on-screen text, chyron, caption overlay, contemporary saturation, winking, irony, logo, watermark, modern smartphone, laptop screen prominent in frame",
  "keyframe": {
    "source": "t2i",
    "ref_lora": "",
    "seed": 348012
  },
  "seed": 348012,
  "continuity": {
    "prev_shot": "NH-S348-SH011",
    "flf2v": false
  },
  "render": {
    "width": 640,
    "height": 640,
    "fps": 16,
    "steps": 4,
    "duration_s": 8
  }
}
