{
  "shot_id": "NH-S05-SH012",
  "song_id": "NH-S05",
  "duration_s": 6,
  "camera": {
    "shot_size": "medium",
    "movement": "static",
    "lens_mm": 50
  },
  "subjects": [
    "stripe_young",
    "debtors",
    "goons"
  ],
  "setting": "EZ Credit storefront / collections",
  "mood": "loan shark menace",
  "action": "The shakedown. Stripe and two goons go door to door through the tenement collecting on easy-credit mattresses: a man held upside down by the ankles as coins rain out, a payment book snatched from a grandmother's hands, the car-door slam on a debtor's hand, a bandaged head emptying pockets into Stripe's open palm while a family pleads.",
  "prompt": "black and white pen line drawing, photomontage collage, young fat ohwx man and two big goons shaking down Bronx tenement families door to door, one goon holding a man upside down by the ankles with coins raining from his pockets, snatching a payment book from a grandmother, slamming a car door on a screaming debtor's hand, man with bandaged head emptying pockets into ohwx man's open palm while a family pleads in a doorway, scratchy ink, film noir shadows, no color, strictly black and white pen line drawing, scratchy confident ink strokes, crosshatch shading, harsh contrast, photomontage collage energy, gritty 1970s Bronx underworld drawn in ink, no color fills, at most a faint gold glint on jewelry",
  "negative_prompt": "photorealism, photograph, realistic skin, cinematic color grading, lens flare, film grain, anime, manga, 3d render, full color scene, skinny young stripe, bald young stripe, smiling, grinning, teeth, real person likeness, MLB logo, watermark",
  "keyframe": {
    "source": "t2i",
    "ref_lora": "stripe_young",
    "seed": 100012
  },
  "seed": 100012,
  "continuity": {
    "prev_shot": "NH-S05-SH011",
    "flf2v": true
  },
  "render": {
    "width": 640,
    "height": 640,
    "fps": 16,
    "steps": 4,
    "duration_s": 6
  }
}
