{
  "shot_id": "NH-S05-SH010",
  "song_id": "NH-S05",
  "duration_s": 6,
  "camera": {
    "shot_size": "medium",
    "movement": "static",
    "lens_mm": 50
  },
  "subjects": [
    "stripe_young",
    "rivals"
  ],
  "setting": "Alley behind the tenements",
  "mood": "brutal, unbothered",
  "action": "Fight. Turf brawl over the mattress corner against three rival hustlers: Stripe swings first, a rival laid out across a busted box spring, another crawling away, Stripe straightening his shades over the bodies while onlookers watch from fire escapes.",
  "prompt": "black and white pen line drawing, alley brawl, young fat ohwx man swinging a fist at three rival 1970s hustlers, one rival collapsed on a busted box spring mattress, another crawling away, onlookers leaning off fire escapes above, trash cans flying, motion lines, aggressive scratchy ink strokes, no color, strictly black and white pen line drawing, scratchy confident ink strokes, crosshatch shading, harsh contrast, photomontage collage energy, gritty 1970s Bronx underworld drawn in ink, no color fills, at most a faint gold glint on jewelry",
  "negative_prompt": "photorealism, photograph, realistic skin, cinematic color grading, lens flare, film grain, anime, manga, 3d render, full color scene, skinny young stripe, bald young stripe, smiling, grinning, teeth, real person likeness, MLB logo, watermark",
  "keyframe": {
    "source": "t2i",
    "ref_lora": "stripe_young",
    "seed": 100010
  },
  "seed": 100010,
  "continuity": {
    "prev_shot": "NH-S05-SH009",
    "flf2v": true
  },
  "render": {
    "width": 640,
    "height": 640,
    "fps": 16,
    "steps": 4,
    "duration_s": 6
  }
}
