{
  "shot_id": "NH-S05-SH008",
  "song_id": "NH-S05",
  "duration_s": 7,
  "camera": {
    "shot_size": "medium",
    "movement": "static",
    "lens_mm": 50
  },
  "subjects": [
    "stripe_young",
    "gamblers"
  ],
  "setting": "Alley craps game",
  "mood": "lucky and loving it",
  "action": "Dice. A tight circle of six hustlers kneeling around an alley craps game, cash on the pavement, dice mid-tumble. Stripe blows on the dice, throws, scoops the whole pot while the losers erupt - one grabs his own hair, another lunges and is held back.",
  "prompt": "black and white pen line drawing, alley craps game, circle of six 1970s Bronx hustlers kneeling around dice and scattered cash on the pavement, young fat ohwx man in owl shirt scooping up the pot of bills, furious losers shouting, one man held back mid-lunge, dice mid-air, scratchy ink, motion lines, no color, strictly black and white pen line drawing, scratchy confident ink strokes, crosshatch shading, harsh contrast, photomontage collage energy, gritty 1970s Bronx underworld drawn in ink, no color fills, at most a faint gold glint on jewelry",
  "negative_prompt": "photorealism, photograph, realistic skin, cinematic color grading, lens flare, film grain, anime, manga, 3d render, full color scene, skinny young stripe, bald young stripe, smiling, grinning, teeth, real person likeness, MLB logo, watermark",
  "keyframe": {
    "source": "t2i",
    "ref_lora": "stripe_young",
    "seed": 100008
  },
  "seed": 100008,
  "continuity": {
    "prev_shot": "NH-S05-SH007",
    "flf2v": true
  },
  "render": {
    "width": 640,
    "height": 640,
    "fps": 16,
    "steps": 4,
    "duration_s": 7
  }
}
