{
  "shot_id": "NH-S901-SH003",
  "song_id": "NH-S901",
  "duration_s": 6,
  "camera": {
    "shot_size": "medium",
    "movement": "locked-off",
    "lens_mm": 35
  },
  "subjects": [
    "construction workers"
  ],
  "setting": "The square, morning",
  "mood": "documentary stillness",
  "action": "The first vertical goes up against the building and its banner. Read as staging; shaped as gallows.",
  "prompt": "low angle, locked-off camera that does not move, two workmen in high-visibility vests and knit caps slowly raise a tall square pine upright toward the vertical, their breath steaming in the cold, a third man steadies a diagonal brace, the low platform frame of open joists in the foreground, behind them the semicircular colonnade of City Hall with the mauve banner, cars parked nose to tail along the kerb do not move, a flatbed truck stacked with fresh lumber and a white box van stand at the kerb with their engines off, the city bus at the far corner is stopped, a few pedestrians in winter coats walk slowly across the square at a distance with their backs to the camera, nobody looks at the timber structure, slow deliberate movement, faces turned away from the camera, prestige political drama, House of Cards season one color grade, Roger Deakins single-source tungsten lighting, anamorphic cinematography, Arri Alexa, slight 35mm film grain, color palette desaturated twelve percent, warm tungstens lifted, deep browns and charcoals in shadows, faint cool blue holding only in the deepest blacks, photographic realism, cinematic",
  "negative_prompt": "cartoon, anime, illustration, painted look, exaggerated lighting, lens flare, smile at camera, comedic expression, caption text overlay, chyron, caption overlay, contemporary saturation, winking, irony, logo, watermark, modern smartphone, laptop screen prominent in frame, human face, portrait, person looking at camera, fast moving cars, speeding traffic, time-lapse, motion blur streaks, camera movement",
  "keyframe": {
    "source": "t2i",
    "ref_lora": "",
    "seed": 901003
  },
  "seed": 901003,
  "continuity": {
    "prev_shot": "NH-S901-SH002",
    "flf2v": false
  },
  "render": {
    "width": 832,
    "height": 480,
    "fps": 16,
    "steps": 4,
    "duration_s": 6
  }
}
