{
  "shot_id": "NH-S901-SH010",
  "song_id": "NH-S901",
  "duration_s": 5,
  "camera": {
    "shot_size": "wide",
    "movement": "locked-off",
    "lens_mm": 24
  },
  "subjects": [],
  "setting": "The square, dusk",
  "mood": "the object alone, before it is dressed as anything else",
  "action": "The finished frame, empty. Raw timber. No bunting. City hall lit behind it.",
  "prompt": "wide shot, locked-off, a finished raw timber platform with two uprights and a heavy crossbeam standing empty in a municipal square at dusk, undressed and undecorated, the lit windows of a mid-century city hall behind it, bare trees, deep blue winter twilight, nobody in frame, prestige political drama, House of Cards season one color grade, Roger Deakins single-source tungsten lighting, anamorphic cinematography, Arri Alexa, slight 35mm film grain, color palette desaturated twelve percent, warm tungstens lifted, deep browns and charcoals in shadows, faint cool blue holding only in the deepest blacks, photographic realism, cinematic",
  "negative_prompt": "cartoon, anime, illustration, painted look, exaggerated lighting, lens flare, smile at camera, comedic expression, on-screen text, chyron, caption overlay, contemporary saturation, winking, irony, logo, watermark, modern smartphone, laptop screen prominent in frame, human face, portrait, person looking at camera",
  "keyframe": {
    "source": "t2i",
    "ref_lora": "",
    "seed": 901010
  },
  "seed": 901010,
  "continuity": {
    "prev_shot": "NH-S901-SH009",
    "flf2v": true
  },
  "render": {
    "width": 640,
    "height": 640,
    "fps": 16,
    "steps": 4,
    "duration_s": 5
  }
}