{
  "shot_id": "NH-S101-SH009",
  "song_id": "NH-S101",
  "duration_s": 8,
  "camera": {
    "shot_size": "close-up",
    "movement": "locked-off",
    "lens_mm": 85
  },
  "subjects": [
    "pengold"
  ],
  "setting": "Pengold's mayoral office at dawn",
  "mood": "no smile, no eyebrow lift, no dramatic gesture",
  "action": "He looks toward the audience, not at us, past us, at the middle distance. He inhales to speak. Holds it. Exhales without having spoken. Then the first bar of the orchestra: a single bass note, low, held.",
  "prompt": "close-up, locked-off, 85mm, a controlled man in his late forties, neat conservative hair greying at the temples, calculating unhurried eyes, medium solid upright build, municipal mayoral suiting in dark muted wool, white shirt, no ostentation, papers aligned squarely, unhurried processional bearing looking past the lens at the middle distance, inhaling as if to speak, holding, exhaling without speaking, tungsten key from a desk lamp, deep charcoal shadow, faint cool blue in the deepest blacks, prestige political drama, House of Cards season one color grade, Roger Deakins single-source tungsten lighting, anamorphic cinematography, Arri Alexa, slight 35mm film grain, color palette desaturated twelve percent, warm tungstens lifted, deep browns and charcoals in shadows, faint cool blue holding only in the deepest blacks, photographic realism, cinematic",
  "negative_prompt": "cartoon, anime, illustration, painted look, exaggerated lighting, lens flare, smile at camera, comedic expression, on-screen text, chyron, caption overlay, contemporary saturation, winking, irony, logo, watermark, modern smartphone, laptop screen prominent in frame",
  "keyframe": {
    "source": "t2i",
    "ref_lora": "pengold",
    "seed": 101009
  },
  "seed": 101009,
  "continuity": {
    "prev_shot": "NH-S101-SH008",
    "flf2v": false
  },
  "render": {
    "width": 640,
    "height": 640,
    "fps": 16,
    "steps": 4,
    "duration_s": 8
  }
}
